{
  "address": "0x81c6ed58E5486d3C67196890A4C2D130bc416191",
  "abi": [
    {
      "inputs": [
        {
          "internalType": "address",
          "name": "admin_",
          "type": "address"
        },
        {
          "internalType": "uint256",
          "name": "delay_",
          "type": "uint256"
        }
      ],
      "stateMutability": "nonpayable",
      "type": "constructor"
    },
    {
      "inputs": [],
      "name": "ZeroAddressNotAllowed",
      "type": "error"
    },
    {
      "anonymous": false,
      "inputs": [
        {
          "indexed": true,
          "internalType": "bytes32",
          "name": "txHash",
          "type": "bytes32"
        },
        {
          "indexed": true,
          "internalType": "address",
          "name": "target",
          "type": "address"
        },
        {
          "indexed": false,
          "internalType": "uint256",
          "name": "value",
          "type": "uint256"
        },
        {
          "indexed": false,
          "internalType": "string",
          "name": "signature",
          "type": "string"
        },
        {
          "indexed": false,
          "internalType": "bytes",
          "name": "data",
          "type": "bytes"
        },
        {
          "indexed": false,
          "internalType": "uint256",
          "name": "eta",
          "type": "uint256"
        }
      ],
      "name": "CancelTransaction",
      "type": "event"
    },
    {
      "anonymous": false,
      "inputs": [
        {
          "indexed": true,
          "internalType": "bytes32",
          "name": "txHash",
          "type": "bytes32"
        },
        {
          "indexed": true,
          "internalType": "address",
          "name": "target",
          "type": "address"
        },
        {
          "indexed": false,
          "internalType": "uint256",
          "name": "value",
          "type": "uint256"
        },
        {
          "indexed": false,
          "internalType": "string",
          "name": "signature",
          "type": "string"
        },
        {
          "indexed": false,
          "internalType": "bytes",
          "name": "data",
          "type": "bytes"
        },
        {
          "indexed": false,
          "internalType": "uint256",
          "name": "eta",
          "type": "uint256"
        }
      ],
      "name": "ExecuteTransaction",
      "type": "event"
    },
    {
      "anonymous": false,
      "inputs": [
        {
          "indexed": true,
          "internalType": "address",
          "name": "oldAdmin",
          "type": "address"
        },
        {
          "indexed": true,
          "internalType": "address",
          "name": "newAdmin",
          "type": "address"
        }
      ],
      "name": "NewAdmin",
      "type": "event"
    },
    {
      "anonymous": false,
      "inputs": [
        {
          "indexed": true,
          "internalType": "uint256",
          "name": "oldDelay",
          "type": "uint256"
        },
        {
          "indexed": true,
          "internalType": "uint256",
          "name": "newDelay",
          "type": "uint256"
        }
      ],
      "name": "NewDelay",
      "type": "event"
    },
    {
      "anonymous": false,
      "inputs": [
        {
          "indexed": true,
          "internalType": "address",
          "name": "newPendingAdmin",
          "type": "address"
        }
      ],
      "name": "NewPendingAdmin",
      "type": "event"
    },
    {
      "anonymous": false,
      "inputs": [
        {
          "indexed": true,
          "internalType": "bytes32",
          "name": "txHash",
          "type": "bytes32"
        },
        {
          "indexed": true,
          "internalType": "address",
          "name": "target",
          "type": "address"
        },
        {
          "indexed": false,
          "internalType": "uint256",
          "name": "value",
          "type": "uint256"
        },
        {
          "indexed": false,
          "internalType": "string",
          "name": "signature",
          "type": "string"
        },
        {
          "indexed": false,
          "internalType": "bytes",
          "name": "data",
          "type": "bytes"
        },
        {
          "indexed": false,
          "internalType": "uint256",
          "name": "eta",
          "type": "uint256"
        }
      ],
      "name": "QueueTransaction",
      "type": "event"
    },
    {
      "stateMutability": "payable",
      "type": "fallback"
    },
    {
      "inputs": [],
      "name": "GRACE_PERIOD",
      "outputs": [
        {
          "internalType": "uint256",
          "name": "",
          "type": "uint256"
        }
      ],
      "stateMutability": "view",
      "type": "function"
    },
    {
      "inputs": [],
      "name": "MAXIMUM_DELAY",
      "outputs": [
        {
          "internalType": "uint256",
          "name": "",
          "type": "uint256"
        }
      ],
      "stateMutability": "view",
      "type": "function"
    },
    {
      "inputs": [],
      "name": "MINIMUM_DELAY",
      "outputs": [
        {
          "internalType": "uint256",
          "name": "",
          "type": "uint256"
        }
      ],
      "stateMutability": "view",
      "type": "function"
    },
    {
      "inputs": [],
      "name": "acceptAdmin",
      "outputs": [],
      "stateMutability": "nonpayable",
      "type": "function"
    },
    {
      "inputs": [],
      "name": "admin",
      "outputs": [
        {
          "internalType": "address",
          "name": "",
          "type": "address"
        }
      ],
      "stateMutability": "view",
      "type": "function"
    },
    {
      "inputs": [
        {
          "internalType": "address",
          "name": "target",
          "type": "address"
        },
        {
          "internalType": "uint256",
          "name": "value",
          "type": "uint256"
        },
        {
          "internalType": "string",
          "name": "signature",
          "type": "string"
        },
        {
          "internalType": "bytes",
          "name": "data",
          "type": "bytes"
        },
        {
          "internalType": "uint256",
          "name": "eta",
          "type": "uint256"
        }
      ],
      "name": "cancelTransaction",
      "outputs": [],
      "stateMutability": "nonpayable",
      "type": "function"
    },
    {
      "inputs": [],
      "name": "delay",
      "outputs": [
        {
          "internalType": "uint256",
          "name": "",
          "type": "uint256"
        }
      ],
      "stateMutability": "view",
      "type": "function"
    },
    {
      "inputs": [
        {
          "internalType": "address",
          "name": "target",
          "type": "address"
        },
        {
          "internalType": "uint256",
          "name": "value",
          "type": "uint256"
        },
        {
          "internalType": "string",
          "name": "signature",
          "type": "string"
        },
        {
          "internalType": "bytes",
          "name": "data",
          "type": "bytes"
        },
        {
          "internalType": "uint256",
          "name": "eta",
          "type": "uint256"
        }
      ],
      "name": "executeTransaction",
      "outputs": [
        {
          "internalType": "bytes",
          "name": "",
          "type": "bytes"
        }
      ],
      "stateMutability": "nonpayable",
      "type": "function"
    },
    {
      "inputs": [],
      "name": "pendingAdmin",
      "outputs": [
        {
          "internalType": "address",
          "name": "",
          "type": "address"
        }
      ],
      "stateMutability": "view",
      "type": "function"
    },
    {
      "inputs": [
        {
          "internalType": "address",
          "name": "target",
          "type": "address"
        },
        {
          "internalType": "uint256",
          "name": "value",
          "type": "uint256"
        },
        {
          "internalType": "string",
          "name": "signature",
          "type": "string"
        },
        {
          "internalType": "bytes",
          "name": "data",
          "type": "bytes"
        },
        {
          "internalType": "uint256",
          "name": "eta",
          "type": "uint256"
        }
      ],
      "name": "queueTransaction",
      "outputs": [
        {
          "internalType": "bytes32",
          "name": "",
          "type": "bytes32"
        }
      ],
      "stateMutability": "nonpayable",
      "type": "function"
    },
    {
      "inputs": [
        {
          "internalType": "bytes32",
          "name": "",
          "type": "bytes32"
        }
      ],
      "name": "queuedTransactions",
      "outputs": [
        {
          "internalType": "bool",
          "name": "",
          "type": "bool"
        }
      ],
      "stateMutability": "view",
      "type": "function"
    },
    {
      "inputs": [
        {
          "internalType": "uint256",
          "name": "delay_",
          "type": "uint256"
        }
      ],
      "name": "setDelay",
      "outputs": [],
      "stateMutability": "nonpayable",
      "type": "function"
    },
    {
      "inputs": [
        {
          "internalType": "address",
          "name": "pendingAdmin_",
          "type": "address"
        }
      ],
      "name": "setPendingAdmin",
      "outputs": [],
      "stateMutability": "nonpayable",
      "type": "function"
    }
  ],
  "transactionHash": "0xcbbbe5414ab1c8f2163de9faafae09dc1b3e6dd6fac38f1a17ecda0a743a28c0",
  "receipt": {
    "to": null,
    "from": "0xfC48EE59b365028DcC533750754330C18d359e27",
    "contractAddress": "0x81c6ed58E5486d3C67196890A4C2D130bc416191",
    "transactionIndex": 0,
    "gasUsed": "1025443",
    "logsBloom": "0x00000000000000000000000000000000000000000000000000000000000000000000000000000000000000000000000000000000000000000000000000000000000000000000000000000000000000000000000000000000000000000000000000000000000000000000000000000000000000000000000000000000000000000000000000000000000000000000000000000000000000000000000000000000000000000000000000000000000000000000000000000000000000000000000000000000000000000000000000000000000000000000000000000000000000000000000000000000000000000000000000000000000000000000000000000000",
    "blockHash": "0xdf92106942a970a5d1d3c1a9c2efa7cc77e248e47804124b6e835c1c5fccfacc",
    "transactionHash": "0xcbbbe5414ab1c8f2163de9faafae09dc1b3e6dd6fac38f1a17ecda0a743a28c0",
    "logs": [],
    "blockNumber": 886402,
    "cumulativeGasUsed": "1025443",
    "status": 1,
    "byzantium": true
  },
  "args": [
    "0xfC48EE59b365028DcC533750754330C18d359e27",
    3600
  ],
  "numDeployments": 1,
  "solcInputHash": "052353d5b1a54343c28ee5ce5f3339f2",
  "metadata": "{\"compiler\":{\"version\":\"0.8.25+commit.b61c2a91\"},\"language\":\"Solidity\",\"output\":{\"abi\":[{\"inputs\":[{\"internalType\":\"address\",\"name\":\"admin_\",\"type\":\"address\"},{\"internalType\":\"uint256\",\"name\":\"delay_\",\"type\":\"uint256\"}],\"stateMutability\":\"nonpayable\",\"type\":\"constructor\"},{\"inputs\":[],\"name\":\"ZeroAddressNotAllowed\",\"type\":\"error\"},{\"anonymous\":false,\"inputs\":[{\"indexed\":true,\"internalType\":\"bytes32\",\"name\":\"txHash\",\"type\":\"bytes32\"},{\"indexed\":true,\"internalType\":\"address\",\"name\":\"target\",\"type\":\"address\"},{\"indexed\":false,\"internalType\":\"uint256\",\"name\":\"value\",\"type\":\"uint256\"},{\"indexed\":false,\"internalType\":\"string\",\"name\":\"signature\",\"type\":\"string\"},{\"indexed\":false,\"internalType\":\"bytes\",\"name\":\"data\",\"type\":\"bytes\"},{\"indexed\":false,\"internalType\":\"uint256\",\"name\":\"eta\",\"type\":\"uint256\"}],\"name\":\"CancelTransaction\",\"type\":\"event\"},{\"anonymous\":false,\"inputs\":[{\"indexed\":true,\"internalType\":\"bytes32\",\"name\":\"txHash\",\"type\":\"bytes32\"},{\"indexed\":true,\"internalType\":\"address\",\"name\":\"target\",\"type\":\"address\"},{\"indexed\":false,\"internalType\":\"uint256\",\"name\":\"value\",\"type\":\"uint256\"},{\"indexed\":false,\"internalType\":\"string\",\"name\":\"signature\",\"type\":\"string\"},{\"indexed\":false,\"internalType\":\"bytes\",\"name\":\"data\",\"type\":\"bytes\"},{\"indexed\":false,\"internalType\":\"uint256\",\"name\":\"eta\",\"type\":\"uint256\"}],\"name\":\"ExecuteTransaction\",\"type\":\"event\"},{\"anonymous\":false,\"inputs\":[{\"indexed\":true,\"internalType\":\"address\",\"name\":\"oldAdmin\",\"type\":\"address\"},{\"indexed\":true,\"internalType\":\"address\",\"name\":\"newAdmin\",\"type\":\"address\"}],\"name\":\"NewAdmin\",\"type\":\"event\"},{\"anonymous\":false,\"inputs\":[{\"indexed\":true,\"internalType\":\"uint256\",\"name\":\"oldDelay\",\"type\":\"uint256\"},{\"indexed\":true,\"internalType\":\"uint256\",\"name\":\"newDelay\",\"type\":\"uint256\"}],\"name\":\"NewDelay\",\"type\":\"event\"},{\"anonymous\":false,\"inputs\":[{\"indexed\":true,\"internalType\":\"address\",\"name\":\"newPendingAdmin\",\"type\":\"address\"}],\"name\":\"NewPendingAdmin\",\"type\":\"event\"},{\"anonymous\":false,\"inputs\":[{\"indexed\":true,\"internalType\":\"bytes32\",\"name\":\"txHash\",\"type\":\"bytes32\"},{\"indexed\":true,\"internalType\":\"address\",\"name\":\"target\",\"type\":\"address\"},{\"indexed\":false,\"internalType\":\"uint256\",\"name\":\"value\",\"type\":\"uint256\"},{\"indexed\":false,\"internalType\":\"string\",\"name\":\"signature\",\"type\":\"string\"},{\"indexed\":false,\"internalType\":\"bytes\",\"name\":\"data\",\"type\":\"bytes\"},{\"indexed\":false,\"internalType\":\"uint256\",\"name\":\"eta\",\"type\":\"uint256\"}],\"name\":\"QueueTransaction\",\"type\":\"event\"},{\"stateMutability\":\"payable\",\"type\":\"fallback\"},{\"inputs\":[],\"name\":\"GRACE_PERIOD\",\"outputs\":[{\"internalType\":\"uint256\",\"name\":\"\",\"type\":\"uint256\"}],\"stateMutability\":\"view\",\"type\":\"function\"},{\"inputs\":[],\"name\":\"MAXIMUM_DELAY\",\"outputs\":[{\"internalType\":\"uint256\",\"name\":\"\",\"type\":\"uint256\"}],\"stateMutability\":\"view\",\"type\":\"function\"},{\"inputs\":[],\"name\":\"MINIMUM_DELAY\",\"outputs\":[{\"internalType\":\"uint256\",\"name\":\"\",\"type\":\"uint256\"}],\"stateMutability\":\"view\",\"type\":\"function\"},{\"inputs\":[],\"name\":\"acceptAdmin\",\"outputs\":[],\"stateMutability\":\"nonpayable\",\"type\":\"function\"},{\"inputs\":[],\"name\":\"admin\",\"outputs\":[{\"internalType\":\"address\",\"name\":\"\",\"type\":\"address\"}],\"stateMutability\":\"view\",\"type\":\"function\"},{\"inputs\":[{\"internalType\":\"address\",\"name\":\"target\",\"type\":\"address\"},{\"internalType\":\"uint256\",\"name\":\"value\",\"type\":\"uint256\"},{\"internalType\":\"string\",\"name\":\"signature\",\"type\":\"string\"},{\"internalType\":\"bytes\",\"name\":\"data\",\"type\":\"bytes\"},{\"internalType\":\"uint256\",\"name\":\"eta\",\"type\":\"uint256\"}],\"name\":\"cancelTransaction\",\"outputs\":[],\"stateMutability\":\"nonpayable\",\"type\":\"function\"},{\"inputs\":[],\"name\":\"delay\",\"outputs\":[{\"internalType\":\"uint256\",\"name\":\"\",\"type\":\"uint256\"}],\"stateMutability\":\"view\",\"type\":\"function\"},{\"inputs\":[{\"internalType\":\"address\",\"name\":\"target\",\"type\":\"address\"},{\"internalType\":\"uint256\",\"name\":\"value\",\"type\":\"uint256\"},{\"internalType\":\"string\",\"name\":\"signature\",\"type\":\"string\"},{\"internalType\":\"bytes\",\"name\":\"data\",\"type\":\"bytes\"},{\"internalType\":\"uint256\",\"name\":\"eta\",\"type\":\"uint256\"}],\"name\":\"executeTransaction\",\"outputs\":[{\"internalType\":\"bytes\",\"name\":\"\",\"type\":\"bytes\"}],\"stateMutability\":\"nonpayable\",\"type\":\"function\"},{\"inputs\":[],\"name\":\"pendingAdmin\",\"outputs\":[{\"internalType\":\"address\",\"name\":\"\",\"type\":\"address\"}],\"stateMutability\":\"view\",\"type\":\"function\"},{\"inputs\":[{\"internalType\":\"address\",\"name\":\"target\",\"type\":\"address\"},{\"internalType\":\"uint256\",\"name\":\"value\",\"type\":\"uint256\"},{\"internalType\":\"string\",\"name\":\"signature\",\"type\":\"string\"},{\"internalType\":\"bytes\",\"name\":\"data\",\"type\":\"bytes\"},{\"internalType\":\"uint256\",\"name\":\"eta\",\"type\":\"uint256\"}],\"name\":\"queueTransaction\",\"outputs\":[{\"internalType\":\"bytes32\",\"name\":\"\",\"type\":\"bytes32\"}],\"stateMutability\":\"nonpayable\",\"type\":\"function\"},{\"inputs\":[{\"internalType\":\"bytes32\",\"name\":\"\",\"type\":\"bytes32\"}],\"name\":\"queuedTransactions\",\"outputs\":[{\"internalType\":\"bool\",\"name\":\"\",\"type\":\"bool\"}],\"stateMutability\":\"view\",\"type\":\"function\"},{\"inputs\":[{\"internalType\":\"uint256\",\"name\":\"delay_\",\"type\":\"uint256\"}],\"name\":\"setDelay\",\"outputs\":[],\"stateMutability\":\"nonpayable\",\"type\":\"function\"},{\"inputs\":[{\"internalType\":\"address\",\"name\":\"pendingAdmin_\",\"type\":\"address\"}],\"name\":\"setPendingAdmin\",\"outputs\":[],\"stateMutability\":\"nonpayable\",\"type\":\"function\"}],\"devdoc\":{\"author\":\"Enclabs\",\"kind\":\"dev\",\"methods\":{\"GRACE_PERIOD()\":{\"returns\":{\"_0\":\"The duration of the grace period, specified as a uint256 value.\"}},\"MAXIMUM_DELAY()\":{\"returns\":{\"_0\":\"Maximum delay\"}},\"MINIMUM_DELAY()\":{\"returns\":{\"_0\":\"Minimum delay\"}},\"acceptAdmin()\":{\"custom:access\":\"Sender must be pending admin\",\"custom:event\":\"Emit NewAdmin with old and new admin\"},\"cancelTransaction(address,uint256,string,bytes,uint256)\":{\"custom:access\":\"Sender must be admin\",\"custom:event\":\"Emit CancelTransaction\",\"params\":{\"data\":\"Arguments to be passed to the function when called\",\"eta\":\"Timestamp after which the transaction can be executed\",\"signature\":\"Signature of the function to be called\",\"target\":\"Address of the contract with the method to be called\",\"value\":\"Native token amount sent with the transaction\"}},\"executeTransaction(address,uint256,string,bytes,uint256)\":{\"custom:access\":\"Sender must be admin\",\"custom:event\":\"Emit ExecuteTransaction\",\"params\":{\"data\":\"Arguments to be passed to the function when called\",\"eta\":\"Timestamp after which the transaction can be executed\",\"signature\":\"Signature of the function to be called\",\"target\":\"Address of the contract with the method to be called\",\"value\":\"Native token amount sent with the transaction\"},\"returns\":{\"_0\":\"Result of function call\"}},\"queueTransaction(address,uint256,string,bytes,uint256)\":{\"custom:access\":\"Sender must be admin\",\"custom:event\":\"Emit QueueTransaction\",\"params\":{\"data\":\"Arguments to be passed to the function when called\",\"eta\":\"Timestamp after which the transaction can be executed\",\"signature\":\"Signature of the function to be called\",\"target\":\"Address of the contract with the method to be called\",\"value\":\"Native token amount sent with the transaction\"},\"returns\":{\"_0\":\"Hash of the queued transaction\"}},\"setDelay(uint256)\":{\"custom:access\":\"Sender must be Timelock itself\",\"custom:event\":\"Emit NewDelay with old and new delay\",\"params\":{\"delay_\":\"The new delay period for the transaction queue\"}},\"setPendingAdmin(address)\":{\"custom:access\":\"Sender must be Timelock contract itself or admin\",\"custom:event\":\"Emit NewPendingAdmin with new pending admin\",\"params\":{\"pendingAdmin_\":\"Address of the proposed admin\"}}},\"title\":\"TimelockV8\",\"version\":1},\"userdoc\":{\"errors\":{\"ZeroAddressNotAllowed()\":[{\"notice\":\"Thrown if the supplied address is a zero address where it is not allowed\"}]},\"events\":{\"CancelTransaction(bytes32,address,uint256,string,bytes,uint256)\":{\"notice\":\"Event emitted when a proposal transaction has been cancelled\"},\"ExecuteTransaction(bytes32,address,uint256,string,bytes,uint256)\":{\"notice\":\"Event emitted when a proposal transaction has been executed\"},\"NewAdmin(address,address)\":{\"notice\":\"Event emitted when a new admin is accepted\"},\"NewDelay(uint256,uint256)\":{\"notice\":\"Event emitted when a new delay is proposed\"},\"NewPendingAdmin(address)\":{\"notice\":\"Event emitted when a new admin is proposed\"},\"QueueTransaction(bytes32,address,uint256,string,bytes,uint256)\":{\"notice\":\"Event emitted when a proposal transaction has been queued\"}},\"kind\":\"user\",\"methods\":{\"GRACE_PERIOD()\":{\"notice\":\"Return grace period\"},\"MAXIMUM_DELAY()\":{\"notice\":\"Return required maximum delay\"},\"MINIMUM_DELAY()\":{\"notice\":\"Return required minimum delay\"},\"acceptAdmin()\":{\"notice\":\"Method for accepting a proposed admin\"},\"admin()\":{\"notice\":\"Timelock admin authorized to queue and execute transactions\"},\"cancelTransaction(address,uint256,string,bytes,uint256)\":{\"notice\":\"Called to cancel a queued transaction\"},\"delay()\":{\"notice\":\"Period for a proposal transaction to be queued\"},\"executeTransaction(address,uint256,string,bytes,uint256)\":{\"notice\":\"Called to execute a queued transaction\"},\"pendingAdmin()\":{\"notice\":\"Account proposed as the next admin\"},\"queueTransaction(address,uint256,string,bytes,uint256)\":{\"notice\":\"Called for each action when queuing a proposal\"},\"queuedTransactions(bytes32)\":{\"notice\":\"Mapping of queued transactions\"},\"setDelay(uint256)\":{\"notice\":\"Setter for the transaction queue delay\"},\"setPendingAdmin(address)\":{\"notice\":\"Method to propose a new admin authorized to call timelock functions. This should be the Governor Contract\"}},\"notice\":\"The Timelock contract using solidity V8. This contract also differs from the original timelock because it has a virtual function to get minimum delays and allow test deployments to override the value.\",\"version\":1}},\"settings\":{\"compilationTarget\":{\"contracts/Governance/TimelockV8.sol\":\"TimelockV8\"},\"evmVersion\":\"paris\",\"libraries\":{},\"metadata\":{\"bytecodeHash\":\"ipfs\",\"useLiteralContent\":true},\"optimizer\":{\"enabled\":true,\"runs\":200},\"remappings\":[]},\"sources\":{\"@venusprotocol/solidity-utilities/contracts/validators.sol\":{\"content\":\"// SPDX-License-Identifier: BSD-3-Clause\\npragma solidity 0.8.25;\\n\\n/// @notice Thrown if the supplied address is a zero address where it is not allowed\\nerror ZeroAddressNotAllowed();\\n\\n/// @notice Thrown if the supplied value is 0 where it is not allowed\\nerror ZeroValueNotAllowed();\\n\\n/// @notice Checks if the provided address is nonzero, reverts otherwise\\n/// @param address_ Address to check\\n/// @custom:error ZeroAddressNotAllowed is thrown if the provided address is a zero address\\nfunction ensureNonzeroAddress(address address_) pure {\\n    if (address_ == address(0)) {\\n        revert ZeroAddressNotAllowed();\\n    }\\n}\\n\\n/// @notice Checks if the provided value is nonzero, reverts otherwise\\n/// @param value_ Value to check\\n/// @custom:error ZeroValueNotAllowed is thrown if the provided value is 0\\nfunction ensureNonzeroValue(uint256 value_) pure {\\n    if (value_ == 0) {\\n        revert ZeroValueNotAllowed();\\n    }\\n}\\n\",\"keccak256\":\"0xdb88e14d50dd21889ca3329d755673d022c47e8da005b6a545c7f69c2c4b7b86\",\"license\":\"BSD-3-Clause\"},\"contracts/Governance/TimelockV8.sol\":{\"content\":\"// SPDX-License-Identifier: BSD-3-Clause\\npragma solidity 0.8.25;\\nimport { ensureNonzeroAddress } from \\\"@venusprotocol/solidity-utilities/contracts/validators.sol\\\";\\n\\n/**\\n * @title TimelockV8\\n * @author Enclabs\\n * @notice The Timelock contract using solidity V8.\\n * This contract also differs from the original timelock because it has a virtual function to get minimum delays\\n * and allow test deployments to override the value.\\n */\\ncontract TimelockV8 {\\n    /// @notice Required period to execute a proposal transaction\\n    uint256 private constant DEFAULT_GRACE_PERIOD = 14 days;\\n\\n    /// @notice Minimum amount of time a proposal transaction must be queued\\n    uint256 private constant DEFAULT_MINIMUM_DELAY = 1 hours;\\n\\n    /// @notice Maximum amount of time a proposal transaction must be queued\\n    uint256 private constant DEFAULT_MAXIMUM_DELAY = 30 days;\\n\\n    /// @notice Timelock admin authorized to queue and execute transactions\\n    address public admin;\\n\\n    /// @notice Account proposed as the next admin\\n    address public pendingAdmin;\\n\\n    /// @notice Period for a proposal transaction to be queued\\n    uint256 public delay;\\n\\n    /// @notice Mapping of queued transactions\\n    mapping(bytes32 => bool) public queuedTransactions;\\n\\n    /// @notice Event emitted when a new admin is accepted\\n    event NewAdmin(address indexed oldAdmin, address indexed newAdmin);\\n\\n    /// @notice Event emitted when a new admin is proposed\\n    event NewPendingAdmin(address indexed newPendingAdmin);\\n\\n    /// @notice Event emitted when a new delay is proposed\\n    event NewDelay(uint256 indexed oldDelay, uint256 indexed newDelay);\\n\\n    /// @notice Event emitted when a proposal transaction has been cancelled\\n    event CancelTransaction(\\n        bytes32 indexed txHash,\\n        address indexed target,\\n        uint256 value,\\n        string signature,\\n        bytes data,\\n        uint256 eta\\n    );\\n\\n    /// @notice Event emitted when a proposal transaction has been executed\\n    event ExecuteTransaction(\\n        bytes32 indexed txHash,\\n        address indexed target,\\n        uint256 value,\\n        string signature,\\n        bytes data,\\n        uint256 eta\\n    );\\n\\n    /// @notice Event emitted when a proposal transaction has been queued\\n    event QueueTransaction(\\n        bytes32 indexed txHash,\\n        address indexed target,\\n        uint256 value,\\n        string signature,\\n        bytes data,\\n        uint256 eta\\n    );\\n\\n    constructor(address admin_, uint256 delay_) {\\n        require(delay_ >= MINIMUM_DELAY(), \\\"Timelock::constructor: Delay must exceed minimum delay.\\\");\\n        require(delay_ <= MAXIMUM_DELAY(), \\\"Timelock::setDelay: Delay must not exceed maximum delay.\\\");\\n        ensureNonzeroAddress(admin_);\\n\\n        admin = admin_;\\n        delay = delay_;\\n    }\\n\\n    fallback() external payable {}\\n\\n    /**\\n     * @notice Setter for the transaction queue delay\\n     * @param delay_ The new delay period for the transaction queue\\n     * @custom:access Sender must be Timelock itself\\n     * @custom:event Emit NewDelay with old and new delay\\n     */\\n    function setDelay(uint256 delay_) public {\\n        require(msg.sender == address(this), \\\"Timelock::setDelay: Call must come from Timelock.\\\");\\n        require(delay_ >= MINIMUM_DELAY(), \\\"Timelock::setDelay: Delay must exceed minimum delay.\\\");\\n        require(delay_ <= MAXIMUM_DELAY(), \\\"Timelock::setDelay: Delay must not exceed maximum delay.\\\");\\n        emit NewDelay(delay, delay_);\\n        delay = delay_;\\n    }\\n\\n    /**\\n     * @notice Return grace period\\n     * @return The duration of the grace period, specified as a uint256 value.\\n     */\\n    function GRACE_PERIOD() public view virtual returns (uint256) {\\n        return DEFAULT_GRACE_PERIOD;\\n    }\\n\\n    /**\\n     * @notice Return required minimum delay\\n     * @return Minimum delay\\n     */\\n    function MINIMUM_DELAY() public view virtual returns (uint256) {\\n        return DEFAULT_MINIMUM_DELAY;\\n    }\\n\\n    /**\\n     * @notice Return required maximum delay\\n     * @return Maximum delay\\n     */\\n    function MAXIMUM_DELAY() public view virtual returns (uint256) {\\n        return DEFAULT_MAXIMUM_DELAY;\\n    }\\n\\n    /**\\n     * @notice Method for accepting a proposed admin\\n     * @custom:access Sender must be pending admin\\n     * @custom:event Emit NewAdmin with old and new admin\\n     */\\n    function acceptAdmin() public {\\n        require(msg.sender == pendingAdmin, \\\"Timelock::acceptAdmin: Call must come from pendingAdmin.\\\");\\n        emit NewAdmin(admin, msg.sender);\\n        admin = msg.sender;\\n        pendingAdmin = address(0);\\n    }\\n\\n    /**\\n     * @notice Method to propose a new admin authorized to call timelock functions. This should be the Governor Contract\\n     * @param pendingAdmin_ Address of the proposed admin\\n     * @custom:access Sender must be Timelock contract itself or admin\\n     * @custom:event Emit NewPendingAdmin with new pending admin\\n     */\\n    function setPendingAdmin(address pendingAdmin_) public {\\n        require(\\n            msg.sender == address(this) || msg.sender == admin,\\n            \\\"Timelock::setPendingAdmin: Call must come from Timelock.\\\"\\n        );\\n        ensureNonzeroAddress(pendingAdmin_);\\n        pendingAdmin = pendingAdmin_;\\n\\n        emit NewPendingAdmin(pendingAdmin);\\n    }\\n\\n    /**\\n     * @notice Called for each action when queuing a proposal\\n     * @param target Address of the contract with the method to be called\\n     * @param value Native token amount sent with the transaction\\n     * @param signature Signature of the function to be called\\n     * @param data Arguments to be passed to the function when called\\n     * @param eta Timestamp after which the transaction can be executed\\n     * @return Hash of the queued transaction\\n     * @custom:access Sender must be admin\\n     * @custom:event Emit QueueTransaction\\n     */\\n    function queueTransaction(\\n        address target,\\n        uint256 value,\\n        string calldata signature,\\n        bytes calldata data,\\n        uint256 eta\\n    ) public returns (bytes32) {\\n        require(msg.sender == admin, \\\"Timelock::queueTransaction: Call must come from admin.\\\");\\n        require(\\n            eta >= getBlockTimestamp() + delay,\\n            \\\"Timelock::queueTransaction: Estimated execution block must satisfy delay.\\\"\\n        );\\n\\n        bytes32 txHash = keccak256(abi.encode(target, value, signature, data, eta));\\n        require(!queuedTransactions[txHash], \\\"Timelock::queueTransaction: transaction already queued.\\\");\\n        queuedTransactions[txHash] = true;\\n\\n        emit QueueTransaction(txHash, target, value, signature, data, eta);\\n        return txHash;\\n    }\\n\\n    /**\\n     * @notice Called to cancel a queued transaction\\n     * @param target Address of the contract with the method to be called\\n     * @param value Native token amount sent with the transaction\\n     * @param signature Signature of the function to be called\\n     * @param data Arguments to be passed to the function when called\\n     * @param eta Timestamp after which the transaction can be executed\\n     * @custom:access Sender must be admin\\n     * @custom:event Emit CancelTransaction\\n     */\\n    function cancelTransaction(\\n        address target,\\n        uint256 value,\\n        string calldata signature,\\n        bytes calldata data,\\n        uint256 eta\\n    ) public {\\n        require(msg.sender == admin, \\\"Timelock::cancelTransaction: Call must come from admin.\\\");\\n\\n        bytes32 txHash = keccak256(abi.encode(target, value, signature, data, eta));\\n        require(queuedTransactions[txHash], \\\"Timelock::cancelTransaction: transaction is not queued yet.\\\");\\n        delete (queuedTransactions[txHash]);\\n\\n        emit CancelTransaction(txHash, target, value, signature, data, eta);\\n    }\\n\\n    /**\\n     * @notice Called to execute a queued transaction\\n     * @param target Address of the contract with the method to be called\\n     * @param value Native token amount sent with the transaction\\n     * @param signature Signature of the function to be called\\n     * @param data Arguments to be passed to the function when called\\n     * @param eta Timestamp after which the transaction can be executed\\n     * @return Result of function call\\n     * @custom:access Sender must be admin\\n     * @custom:event Emit ExecuteTransaction\\n     */\\n    function executeTransaction(\\n        address target,\\n        uint256 value,\\n        string calldata signature,\\n        bytes calldata data,\\n        uint256 eta\\n    ) public returns (bytes memory) {\\n        require(msg.sender == admin, \\\"Timelock::executeTransaction: Call must come from admin.\\\");\\n\\n        bytes32 txHash = keccak256(abi.encode(target, value, signature, data, eta));\\n        require(queuedTransactions[txHash], \\\"Timelock::executeTransaction: Transaction hasn't been queued.\\\");\\n        require(getBlockTimestamp() >= eta, \\\"Timelock::executeTransaction: Transaction hasn't surpassed time lock.\\\");\\n        require(getBlockTimestamp() <= eta + GRACE_PERIOD(), \\\"Timelock::executeTransaction: Transaction is stale.\\\");\\n\\n        delete (queuedTransactions[txHash]);\\n\\n        bytes memory callData;\\n\\n        if (bytes(signature).length == 0) {\\n            callData = data;\\n        } else {\\n            callData = abi.encodePacked(bytes4(keccak256(bytes(signature))), data);\\n        }\\n\\n        // solium-disable-next-line security/no-call-value\\n        (bool success, bytes memory returnData) = target.call{ value: value }(callData);\\n        require(success, \\\"Timelock::executeTransaction: Transaction execution reverted.\\\");\\n\\n        emit ExecuteTransaction(txHash, target, value, signature, data, eta);\\n\\n        return returnData;\\n    }\\n\\n    /**\\n     * @notice Returns the current block timestamp\\n     * @return The current block timestamp\\n     */\\n    function getBlockTimestamp() internal view returns (uint256) {\\n        // solium-disable-next-line security/no-block-members\\n        return block.timestamp;\\n    }\\n}\\n\",\"keccak256\":\"0xa7cd30f6e7927d7a7f8409d65d5b05ef0160b59f11e12d1642961a87d182320b\",\"license\":\"BSD-3-Clause\"}},\"version\":1}",
  "bytecode": "0x608060405234801561001057600080fd5b5060405161127238038061127283398101604081905261002f91610181565b610e108110156100ac5760405162461bcd60e51b815260206004820152603760248201527f54696d656c6f636b3a3a636f6e7374727563746f723a2044656c6179206d757360448201527f7420657863656564206d696e696d756d2064656c61792e00000000000000000060648201526084015b60405180910390fd5b62278d008111156101255760405162461bcd60e51b815260206004820152603860248201527f54696d656c6f636b3a3a73657444656c61793a2044656c6179206d757374206e60448201527f6f7420657863656564206d6178696d756d2064656c61792e000000000000000060648201526084016100a3565b61012e82610157565b600080546001600160a01b0319166001600160a01b0393909316929092179091556002556101bb565b6001600160a01b03811661017e576040516342bcdf7f60e11b815260040160405180910390fd5b50565b6000806040838503121561019457600080fd5b82516001600160a01b03811681146101ab57600080fd5b6020939093015192949293505050565b6110a8806101ca6000396000f3fe6080604052600436106100bc5760003560e01c80636a42b8f811610079578063c1a287e211610056578063c1a287e2146101f0578063e177246e14610206578063f2b0653714610226578063f851a4401461026657005b80636a42b8f8146101af5780637d645fab146101c5578063b1b43ae5146101db57005b80630825f38f146100be5780630e18b681146100f457806326782247146101095780633a66f901146101415780634dd18bf51461016f578063591fcdfe1461018f575b005b3480156100ca57600080fd5b506100de6100d9366004610dfc565b610286565b6040516100eb9190610eb3565b60405180910390f35b34801561010057600080fd5b506100bc610649565b34801561011557600080fd5b50600154610129906001600160a01b031681565b6040516001600160a01b0390911681526020016100eb565b34801561014d57600080fd5b5061016161015c366004610dfc565b610721565b6040519081526020016100eb565b34801561017b57600080fd5b506100bc61018a366004610ee6565b610960565b34801561019b57600080fd5b506100bc6101aa366004610dfc565b610a3d565b3480156101bb57600080fd5b5061016160025481565b3480156101d157600080fd5b5062278d00610161565b3480156101e757600080fd5b50610e10610161565b3480156101fc57600080fd5b5062127500610161565b34801561021257600080fd5b506100bc610221366004610f08565b610be8565b34801561023257600080fd5b50610256610241366004610f08565b60036020526000908152604090205460ff1681565b60405190151581526020016100eb565b34801561027257600080fd5b50600054610129906001600160a01b031681565b6000546060906001600160a01b0316331461030e5760405162461bcd60e51b815260206004820152603860248201527f54696d656c6f636b3a3a657865637574655472616e73616374696f6e3a20436160448201527f6c6c206d75737420636f6d652066726f6d2061646d696e2e000000000000000060648201526084015b60405180910390fd5b60008888888888888860405160200161032d9796959493929190610f4a565b60408051601f1981840301815291815281516020928301206000818152600390935291205490915060ff166103b85760405162461bcd60e51b815260206004820152603d602482015260008051602061105383398151915260448201527f616e73616374696f6e206861736e2774206265656e207175657565642e0000006064820152608401610305565b8242101561042a5760405162461bcd60e51b8152602060048201526045602482015260008051602061105383398151915260448201527f616e73616374696f6e206861736e2774207375727061737365642074696d65206064820152643637b1b59760d91b608482015260a401610305565b6104376212750084610f9a565b4211156104905760405162461bcd60e51b8152602060048201526033602482015260008051602061105383398151915260448201527230b739b0b1ba34b7b71034b99039ba30b6329760691b6064820152608401610305565b6000818152600360205260408120805460ff191690556060908790036104ef5785858080601f01602080910402602001604051908101604052809392919081815260200183838082843760009201919091525092935061052a92505050565b87876040516104ff929190610fc1565b6040519081900381206105189188908890602001610fd1565b60405160208183030381529060405290505b6000808b6001600160a01b03168b846040516105469190610ff5565b60006040518083038185875af1925050503d8060008114610583576040519150601f19603f3d011682016040523d82523d6000602084013e610588565b606091505b5091509150816105ee5760405162461bcd60e51b815260206004820152603d602482015260008051602061105383398151915260448201527f616e73616374696f6e20657865637574696f6e2072657665727465642e0000006064820152608401610305565b8b6001600160a01b0316847fa560e3198060a2f10670c1ec5b403077ea6ae93ca8de1c32b451dc1a943cd6e78d8d8d8d8d8d60405161063296959493929190611011565b60405180910390a39b9a5050505050505050505050565b6001546001600160a01b031633146106c95760405162461bcd60e51b815260206004820152603860248201527f54696d656c6f636b3a3a61636365707441646d696e3a2043616c6c206d75737460448201527f20636f6d652066726f6d2070656e64696e6741646d696e2e00000000000000006064820152608401610305565b6000805460405133926001600160a01b03909216917ff9ffabca9c8276e99321725bcb43fb076a6c66a54b7f21c4e8146d8519b417dc91a3600080546001600160a01b03199081163317909155600180549091169055565b600080546001600160a01b0316331461079b5760405162461bcd60e51b815260206004820152603660248201527f54696d656c6f636b3a3a71756575655472616e73616374696f6e3a2043616c6c6044820152751036bab9ba1031b7b6b290333937b69030b236b4b71760511b6064820152608401610305565b6002546107a89042610f9a565b82101561082f5760405162461bcd60e51b815260206004820152604960248201527f54696d656c6f636b3a3a71756575655472616e73616374696f6e3a204573746960448201527f6d6174656420657865637574696f6e20626c6f636b206d757374207361746973606482015268333c903232b630bc9760b91b608482015260a401610305565b60008888888888888860405160200161084e9796959493929190610f4a565b60408051601f1981840301815291815281516020928301206000818152600390935291205490915060ff16156108ec5760405162461bcd60e51b815260206004820152603760248201527f54696d656c6f636b3a3a71756575655472616e73616374696f6e3a207472616e60448201527f73616374696f6e20616c7265616479207175657565642e0000000000000000006064820152608401610305565b60008181526003602052604090819020805460ff19166001179055516001600160a01b038a169082907f76e2796dc3a81d57b0e8504b647febcbeeb5f4af818e164f11eef8131a6a763f9061094c908c908c908c908c908c908c90611011565b60405180910390a398975050505050505050565b3330148061097857506000546001600160a01b031633145b6109ea5760405162461bcd60e51b815260206004820152603860248201527f54696d656c6f636b3a3a73657450656e64696e6741646d696e3a2043616c6c2060448201527f6d75737420636f6d652066726f6d2054696d656c6f636b2e00000000000000006064820152608401610305565b6109f381610d6d565b600180546001600160a01b0319166001600160a01b0383169081179091556040517f69d78e38a01985fbb1462961809b4b2d65531bc93b2b94037f3334b82ca4a75690600090a250565b6000546001600160a01b03163314610abd5760405162461bcd60e51b815260206004820152603760248201527f54696d656c6f636b3a3a63616e63656c5472616e73616374696f6e3a2043616c60448201527f6c206d75737420636f6d652066726f6d2061646d696e2e0000000000000000006064820152608401610305565b600087878787878787604051602001610adc9796959493929190610f4a565b60408051601f1981840301815291815281516020928301206000818152600390935291205490915060ff16610b795760405162461bcd60e51b815260206004820152603b60248201527f54696d656c6f636b3a3a63616e63656c5472616e73616374696f6e3a2074726160448201527f6e73616374696f6e206973206e6f7420717565756564207965742e00000000006064820152608401610305565b60008181526003602052604090819020805460ff19169055516001600160a01b0389169082907f2fffc091a501fd91bfbff27141450d3acb40fb8e6d8382b243ec7a812a3aaf8790610bd6908b908b908b908b908b908b90611011565b60405180910390a35050505050505050565b333014610c515760405162461bcd60e51b815260206004820152603160248201527f54696d656c6f636b3a3a73657444656c61793a2043616c6c206d75737420636f60448201527036b290333937b6902a34b6b2b637b1b59760791b6064820152608401610305565b610e10811015610cc05760405162461bcd60e51b815260206004820152603460248201527f54696d656c6f636b3a3a73657444656c61793a2044656c6179206d75737420656044820152733c31b2b2b21036b4b734b6bab6903232b630bc9760611b6064820152608401610305565b62278d00811115610d395760405162461bcd60e51b815260206004820152603860248201527f54696d656c6f636b3a3a73657444656c61793a2044656c6179206d757374206e60448201527f6f7420657863656564206d6178696d756d2064656c61792e00000000000000006064820152608401610305565b6002546040518291907fed0229422af39d4d7d33f7a27d31d6f5cb20ec628293da58dd6e8a528ed466be90600090a3600255565b6001600160a01b038116610d94576040516342bcdf7f60e11b815260040160405180910390fd5b50565b80356001600160a01b0381168114610dae57600080fd5b919050565b60008083601f840112610dc557600080fd5b50813567ffffffffffffffff811115610ddd57600080fd5b602083019150836020828501011115610df557600080fd5b9250929050565b600080600080600080600060a0888a031215610e1757600080fd5b610e2088610d97565b965060208801359550604088013567ffffffffffffffff80821115610e4457600080fd5b610e508b838c01610db3565b909750955060608a0135915080821115610e6957600080fd5b50610e768a828b01610db3565b989b979a50959894979596608090950135949350505050565b60005b83811015610eaa578181015183820152602001610e92565b50506000910152565b6020815260008251806020840152610ed2816040850160208701610e8f565b601f01601f19169190910160400192915050565b600060208284031215610ef857600080fd5b610f0182610d97565b9392505050565b600060208284031215610f1a57600080fd5b5035919050565b81835281816020850137506000828201602090810191909152601f909101601f19169091010190565b60018060a01b038816815286602082015260a060408201526000610f7260a083018789610f21565b8281036060840152610f85818688610f21565b91505082608083015298975050505050505050565b80820180821115610fbb57634e487b7160e01b600052601160045260246000fd5b92915050565b8183823760009101908152919050565b6001600160e01b031984168152818360048301376000910160040190815292915050565b60008251611007818460208701610e8f565b9190910192915050565b86815260806020820152600061102b608083018789610f21565b828103604084015261103e818688610f21565b91505082606083015297965050505050505056fe54696d656c6f636b3a3a657865637574655472616e73616374696f6e3a205472a2646970667358221220685dd1afbf9ca1fec9f9e28f09362da05eced450d3e6f0f438d17ae38c2fa0b764736f6c63430008190033",
  "deployedBytecode": "0x6080604052600436106100bc5760003560e01c80636a42b8f811610079578063c1a287e211610056578063c1a287e2146101f0578063e177246e14610206578063f2b0653714610226578063f851a4401461026657005b80636a42b8f8146101af5780637d645fab146101c5578063b1b43ae5146101db57005b80630825f38f146100be5780630e18b681146100f457806326782247146101095780633a66f901146101415780634dd18bf51461016f578063591fcdfe1461018f575b005b3480156100ca57600080fd5b506100de6100d9366004610dfc565b610286565b6040516100eb9190610eb3565b60405180910390f35b34801561010057600080fd5b506100bc610649565b34801561011557600080fd5b50600154610129906001600160a01b031681565b6040516001600160a01b0390911681526020016100eb565b34801561014d57600080fd5b5061016161015c366004610dfc565b610721565b6040519081526020016100eb565b34801561017b57600080fd5b506100bc61018a366004610ee6565b610960565b34801561019b57600080fd5b506100bc6101aa366004610dfc565b610a3d565b3480156101bb57600080fd5b5061016160025481565b3480156101d157600080fd5b5062278d00610161565b3480156101e757600080fd5b50610e10610161565b3480156101fc57600080fd5b5062127500610161565b34801561021257600080fd5b506100bc610221366004610f08565b610be8565b34801561023257600080fd5b50610256610241366004610f08565b60036020526000908152604090205460ff1681565b60405190151581526020016100eb565b34801561027257600080fd5b50600054610129906001600160a01b031681565b6000546060906001600160a01b0316331461030e5760405162461bcd60e51b815260206004820152603860248201527f54696d656c6f636b3a3a657865637574655472616e73616374696f6e3a20436160448201527f6c6c206d75737420636f6d652066726f6d2061646d696e2e000000000000000060648201526084015b60405180910390fd5b60008888888888888860405160200161032d9796959493929190610f4a565b60408051601f1981840301815291815281516020928301206000818152600390935291205490915060ff166103b85760405162461bcd60e51b815260206004820152603d602482015260008051602061105383398151915260448201527f616e73616374696f6e206861736e2774206265656e207175657565642e0000006064820152608401610305565b8242101561042a5760405162461bcd60e51b8152602060048201526045602482015260008051602061105383398151915260448201527f616e73616374696f6e206861736e2774207375727061737365642074696d65206064820152643637b1b59760d91b608482015260a401610305565b6104376212750084610f9a565b4211156104905760405162461bcd60e51b8152602060048201526033602482015260008051602061105383398151915260448201527230b739b0b1ba34b7b71034b99039ba30b6329760691b6064820152608401610305565b6000818152600360205260408120805460ff191690556060908790036104ef5785858080601f01602080910402602001604051908101604052809392919081815260200183838082843760009201919091525092935061052a92505050565b87876040516104ff929190610fc1565b6040519081900381206105189188908890602001610fd1565b60405160208183030381529060405290505b6000808b6001600160a01b03168b846040516105469190610ff5565b60006040518083038185875af1925050503d8060008114610583576040519150601f19603f3d011682016040523d82523d6000602084013e610588565b606091505b5091509150816105ee5760405162461bcd60e51b815260206004820152603d602482015260008051602061105383398151915260448201527f616e73616374696f6e20657865637574696f6e2072657665727465642e0000006064820152608401610305565b8b6001600160a01b0316847fa560e3198060a2f10670c1ec5b403077ea6ae93ca8de1c32b451dc1a943cd6e78d8d8d8d8d8d60405161063296959493929190611011565b60405180910390a39b9a5050505050505050505050565b6001546001600160a01b031633146106c95760405162461bcd60e51b815260206004820152603860248201527f54696d656c6f636b3a3a61636365707441646d696e3a2043616c6c206d75737460448201527f20636f6d652066726f6d2070656e64696e6741646d696e2e00000000000000006064820152608401610305565b6000805460405133926001600160a01b03909216917ff9ffabca9c8276e99321725bcb43fb076a6c66a54b7f21c4e8146d8519b417dc91a3600080546001600160a01b03199081163317909155600180549091169055565b600080546001600160a01b0316331461079b5760405162461bcd60e51b815260206004820152603660248201527f54696d656c6f636b3a3a71756575655472616e73616374696f6e3a2043616c6c6044820152751036bab9ba1031b7b6b290333937b69030b236b4b71760511b6064820152608401610305565b6002546107a89042610f9a565b82101561082f5760405162461bcd60e51b815260206004820152604960248201527f54696d656c6f636b3a3a71756575655472616e73616374696f6e3a204573746960448201527f6d6174656420657865637574696f6e20626c6f636b206d757374207361746973606482015268333c903232b630bc9760b91b608482015260a401610305565b60008888888888888860405160200161084e9796959493929190610f4a565b60408051601f1981840301815291815281516020928301206000818152600390935291205490915060ff16156108ec5760405162461bcd60e51b815260206004820152603760248201527f54696d656c6f636b3a3a71756575655472616e73616374696f6e3a207472616e60448201527f73616374696f6e20616c7265616479207175657565642e0000000000000000006064820152608401610305565b60008181526003602052604090819020805460ff19166001179055516001600160a01b038a169082907f76e2796dc3a81d57b0e8504b647febcbeeb5f4af818e164f11eef8131a6a763f9061094c908c908c908c908c908c908c90611011565b60405180910390a398975050505050505050565b3330148061097857506000546001600160a01b031633145b6109ea5760405162461bcd60e51b815260206004820152603860248201527f54696d656c6f636b3a3a73657450656e64696e6741646d696e3a2043616c6c2060448201527f6d75737420636f6d652066726f6d2054696d656c6f636b2e00000000000000006064820152608401610305565b6109f381610d6d565b600180546001600160a01b0319166001600160a01b0383169081179091556040517f69d78e38a01985fbb1462961809b4b2d65531bc93b2b94037f3334b82ca4a75690600090a250565b6000546001600160a01b03163314610abd5760405162461bcd60e51b815260206004820152603760248201527f54696d656c6f636b3a3a63616e63656c5472616e73616374696f6e3a2043616c60448201527f6c206d75737420636f6d652066726f6d2061646d696e2e0000000000000000006064820152608401610305565b600087878787878787604051602001610adc9796959493929190610f4a565b60408051601f1981840301815291815281516020928301206000818152600390935291205490915060ff16610b795760405162461bcd60e51b815260206004820152603b60248201527f54696d656c6f636b3a3a63616e63656c5472616e73616374696f6e3a2074726160448201527f6e73616374696f6e206973206e6f7420717565756564207965742e00000000006064820152608401610305565b60008181526003602052604090819020805460ff19169055516001600160a01b0389169082907f2fffc091a501fd91bfbff27141450d3acb40fb8e6d8382b243ec7a812a3aaf8790610bd6908b908b908b908b908b908b90611011565b60405180910390a35050505050505050565b333014610c515760405162461bcd60e51b815260206004820152603160248201527f54696d656c6f636b3a3a73657444656c61793a2043616c6c206d75737420636f60448201527036b290333937b6902a34b6b2b637b1b59760791b6064820152608401610305565b610e10811015610cc05760405162461bcd60e51b815260206004820152603460248201527f54696d656c6f636b3a3a73657444656c61793a2044656c6179206d75737420656044820152733c31b2b2b21036b4b734b6bab6903232b630bc9760611b6064820152608401610305565b62278d00811115610d395760405162461bcd60e51b815260206004820152603860248201527f54696d656c6f636b3a3a73657444656c61793a2044656c6179206d757374206e60448201527f6f7420657863656564206d6178696d756d2064656c61792e00000000000000006064820152608401610305565b6002546040518291907fed0229422af39d4d7d33f7a27d31d6f5cb20ec628293da58dd6e8a528ed466be90600090a3600255565b6001600160a01b038116610d94576040516342bcdf7f60e11b815260040160405180910390fd5b50565b80356001600160a01b0381168114610dae57600080fd5b919050565b60008083601f840112610dc557600080fd5b50813567ffffffffffffffff811115610ddd57600080fd5b602083019150836020828501011115610df557600080fd5b9250929050565b600080600080600080600060a0888a031215610e1757600080fd5b610e2088610d97565b965060208801359550604088013567ffffffffffffffff80821115610e4457600080fd5b610e508b838c01610db3565b909750955060608a0135915080821115610e6957600080fd5b50610e768a828b01610db3565b989b979a50959894979596608090950135949350505050565b60005b83811015610eaa578181015183820152602001610e92565b50506000910152565b6020815260008251806020840152610ed2816040850160208701610e8f565b601f01601f19169190910160400192915050565b600060208284031215610ef857600080fd5b610f0182610d97565b9392505050565b600060208284031215610f1a57600080fd5b5035919050565b81835281816020850137506000828201602090810191909152601f909101601f19169091010190565b60018060a01b038816815286602082015260a060408201526000610f7260a083018789610f21565b8281036060840152610f85818688610f21565b91505082608083015298975050505050505050565b80820180821115610fbb57634e487b7160e01b600052601160045260246000fd5b92915050565b8183823760009101908152919050565b6001600160e01b031984168152818360048301376000910160040190815292915050565b60008251611007818460208701610e8f565b9190910192915050565b86815260806020820152600061102b608083018789610f21565b828103604084015261103e818688610f21565b91505082606083015297965050505050505056fe54696d656c6f636b3a3a657865637574655472616e73616374696f6e3a205472a2646970667358221220685dd1afbf9ca1fec9f9e28f09362da05eced450d3e6f0f438d17ae38c2fa0b764736f6c63430008190033",
  "devdoc": {
    "author": "Enclabs",
    "kind": "dev",
    "methods": {
      "GRACE_PERIOD()": {
        "returns": {
          "_0": "The duration of the grace period, specified as a uint256 value."
        }
      },
      "MAXIMUM_DELAY()": {
        "returns": {
          "_0": "Maximum delay"
        }
      },
      "MINIMUM_DELAY()": {
        "returns": {
          "_0": "Minimum delay"
        }
      },
      "acceptAdmin()": {
        "custom:access": "Sender must be pending admin",
        "custom:event": "Emit NewAdmin with old and new admin"
      },
      "cancelTransaction(address,uint256,string,bytes,uint256)": {
        "custom:access": "Sender must be admin",
        "custom:event": "Emit CancelTransaction",
        "params": {
          "data": "Arguments to be passed to the function when called",
          "eta": "Timestamp after which the transaction can be executed",
          "signature": "Signature of the function to be called",
          "target": "Address of the contract with the method to be called",
          "value": "Native token amount sent with the transaction"
        }
      },
      "executeTransaction(address,uint256,string,bytes,uint256)": {
        "custom:access": "Sender must be admin",
        "custom:event": "Emit ExecuteTransaction",
        "params": {
          "data": "Arguments to be passed to the function when called",
          "eta": "Timestamp after which the transaction can be executed",
          "signature": "Signature of the function to be called",
          "target": "Address of the contract with the method to be called",
          "value": "Native token amount sent with the transaction"
        },
        "returns": {
          "_0": "Result of function call"
        }
      },
      "queueTransaction(address,uint256,string,bytes,uint256)": {
        "custom:access": "Sender must be admin",
        "custom:event": "Emit QueueTransaction",
        "params": {
          "data": "Arguments to be passed to the function when called",
          "eta": "Timestamp after which the transaction can be executed",
          "signature": "Signature of the function to be called",
          "target": "Address of the contract with the method to be called",
          "value": "Native token amount sent with the transaction"
        },
        "returns": {
          "_0": "Hash of the queued transaction"
        }
      },
      "setDelay(uint256)": {
        "custom:access": "Sender must be Timelock itself",
        "custom:event": "Emit NewDelay with old and new delay",
        "params": {
          "delay_": "The new delay period for the transaction queue"
        }
      },
      "setPendingAdmin(address)": {
        "custom:access": "Sender must be Timelock contract itself or admin",
        "custom:event": "Emit NewPendingAdmin with new pending admin",
        "params": {
          "pendingAdmin_": "Address of the proposed admin"
        }
      }
    },
    "title": "TimelockV8",
    "version": 1
  },
  "userdoc": {
    "errors": {
      "ZeroAddressNotAllowed()": [
        {
          "notice": "Thrown if the supplied address is a zero address where it is not allowed"
        }
      ]
    },
    "events": {
      "CancelTransaction(bytes32,address,uint256,string,bytes,uint256)": {
        "notice": "Event emitted when a proposal transaction has been cancelled"
      },
      "ExecuteTransaction(bytes32,address,uint256,string,bytes,uint256)": {
        "notice": "Event emitted when a proposal transaction has been executed"
      },
      "NewAdmin(address,address)": {
        "notice": "Event emitted when a new admin is accepted"
      },
      "NewDelay(uint256,uint256)": {
        "notice": "Event emitted when a new delay is proposed"
      },
      "NewPendingAdmin(address)": {
        "notice": "Event emitted when a new admin is proposed"
      },
      "QueueTransaction(bytes32,address,uint256,string,bytes,uint256)": {
        "notice": "Event emitted when a proposal transaction has been queued"
      }
    },
    "kind": "user",
    "methods": {
      "GRACE_PERIOD()": {
        "notice": "Return grace period"
      },
      "MAXIMUM_DELAY()": {
        "notice": "Return required maximum delay"
      },
      "MINIMUM_DELAY()": {
        "notice": "Return required minimum delay"
      },
      "acceptAdmin()": {
        "notice": "Method for accepting a proposed admin"
      },
      "admin()": {
        "notice": "Timelock admin authorized to queue and execute transactions"
      },
      "cancelTransaction(address,uint256,string,bytes,uint256)": {
        "notice": "Called to cancel a queued transaction"
      },
      "delay()": {
        "notice": "Period for a proposal transaction to be queued"
      },
      "executeTransaction(address,uint256,string,bytes,uint256)": {
        "notice": "Called to execute a queued transaction"
      },
      "pendingAdmin()": {
        "notice": "Account proposed as the next admin"
      },
      "queueTransaction(address,uint256,string,bytes,uint256)": {
        "notice": "Called for each action when queuing a proposal"
      },
      "queuedTransactions(bytes32)": {
        "notice": "Mapping of queued transactions"
      },
      "setDelay(uint256)": {
        "notice": "Setter for the transaction queue delay"
      },
      "setPendingAdmin(address)": {
        "notice": "Method to propose a new admin authorized to call timelock functions. This should be the Governor Contract"
      }
    },
    "notice": "The Timelock contract using solidity V8. This contract also differs from the original timelock because it has a virtual function to get minimum delays and allow test deployments to override the value.",
    "version": 1
  },
  "storageLayout": {
    "storage": [
      {
        "astId": 14678,
        "contract": "contracts/Governance/TimelockV8.sol:TimelockV8",
        "label": "admin",
        "offset": 0,
        "slot": "0",
        "type": "t_address"
      },
      {
        "astId": 14681,
        "contract": "contracts/Governance/TimelockV8.sol:TimelockV8",
        "label": "pendingAdmin",
        "offset": 0,
        "slot": "1",
        "type": "t_address"
      },
      {
        "astId": 14684,
        "contract": "contracts/Governance/TimelockV8.sol:TimelockV8",
        "label": "delay",
        "offset": 0,
        "slot": "2",
        "type": "t_uint256"
      },
      {
        "astId": 14689,
        "contract": "contracts/Governance/TimelockV8.sol:TimelockV8",
        "label": "queuedTransactions",
        "offset": 0,
        "slot": "3",
        "type": "t_mapping(t_bytes32,t_bool)"
      }
    ],
    "types": {
      "t_address": {
        "encoding": "inplace",
        "label": "address",
        "numberOfBytes": "20"
      },
      "t_bool": {
        "encoding": "inplace",
        "label": "bool",
        "numberOfBytes": "1"
      },
      "t_bytes32": {
        "encoding": "inplace",
        "label": "bytes32",
        "numberOfBytes": "32"
      },
      "t_mapping(t_bytes32,t_bool)": {
        "encoding": "mapping",
        "key": "t_bytes32",
        "label": "mapping(bytes32 => bool)",
        "numberOfBytes": "32",
        "value": "t_bool"
      },
      "t_uint256": {
        "encoding": "inplace",
        "label": "uint256",
        "numberOfBytes": "32"
      }
    }
  }
}